{
  "sample_id": "face_redacted_001",
  "identity_match": "inconclusive",
  "poi_status": "unknown",
  "image_quality": "degraded",
  "duplicate_face_record": false,
  "manual_escalation_required": true,
  "adjudication_notes": "Occlusion and angle prevent defensible identity linkage. Escalated for manual review.",
  "reviewer_role": "adjudicator",
  "reviewed_at": "2026-05-18T00:00:00.000Z"
}